<?xml version="1.0" encoding="UTF-8"?>
<Obrazac_P1 xmlns="http://p1.euprava.com/model"
    xmlns:xsi="http://www.w3.org/2001/XMLSchema-instance"
    xsi:schemaLocation="http://p1.euprava.com/model ../schemas/p1_schema.xsd">
    <Popunjava_zavod>
        <Broj_prijave>1/23</Broj_prijave>
        <Datum_prijema>2023-01-19</Datum_prijema>
        <Priznati_datum_podnosenja>2023-01-19</Priznati_datum_podnosenja>
    </Popunjava_zavod>
    <Zahtev_za_priznanje_patenta>
        <Naziv_pronalaska>
            <Na_srpskom>Automatski sistemi kočenja</Na_srpskom>
            <Na_engleskom>Autonomous braking system</Na_engleskom>
        </Naziv_pronalaska>
        <Podnosilac pronalazac="false" xsi:type="TPravni_podnosilac">
            <Adresa>
                <Ulica>Glavna</Ulica>
                <Broj>23</Broj>
                <Postanski_broj>11080</Postanski_broj>
                <Mesto>Zemun</Mesto>
                <Drzava>Srbija</Drzava>
            </Adresa>
            <Kontakt>
                <Broj_telefona>011/2194-492</Broj_telefona>
                <E_posta>br_assistant@gmail.com</E_posta>
                <Broj_faksa>011/2194-492</Broj_faksa>
            </Kontakt>
            <Poslovno_ime>BRAKING ASSISTANT</Poslovno_ime>
        </Podnosilac>
        <Pronalazac>
            <Adresa>
                <Ulica>4. Sremski Bataljon</Ulica>
                <Broj>10</Broj>
                <Postanski_broj>11080</Postanski_broj>
                <Mesto>Zemun</Mesto>
                <Drzava>Srbija</Drzava>
            </Adresa>
            <Kontakt>
                <Broj_telefona>066/936-8575</Broj_telefona>
                <E_posta>dilic@gmail.com</E_posta>
            </Kontakt>
            <Ime>Dragutin</Ime>
            <Prezime>ILIĆ</Prezime>
        </Pronalazac>
        <Punomocnik tip="Punomocnik_za_prijem_pismena" xsi:type="TFizicki_punomocnik">
            <Adresa>
                <Ulica>4. Sremski bataljon</Ulica>
                <Broj>6</Broj>
                <Postanski_broj>11080</Postanski_broj>
                <Mesto>Zemun</Mesto>
            </Adresa>
            <Kontakt>
                <Broj_telefona>066/936-8581</Broj_telefona>
                <E_posta>jovanr@gmail.com</E_posta>
            </Kontakt>
            <Ime>Jovan</Ime>
            <Prezime>RAJAČIĆ</Prezime>
        </Punomocnik>
        <Nacin_dostavljanja>Papirna_forma</Nacin_dostavljanja>
        <Povezana_prijava tip="Dopunska_prijava">
            <Broj_prijave>1/22</Broj_prijave>
            <Datum_podnosenja>2022-01-10</Datum_podnosenja>
        </Povezana_prijava>
        <Zahtev_za_priznanje_prava_prvenstva>
            <Ranija_prijava oznaka_drzave="RS">
                <Broj_prijave>3/22</Broj_prijave>
                <Datum_podnosenja>2022-12-12</Datum_podnosenja>
            </Ranija_prijava>
            <Ranija_prijava oznaka_drzave="RS">
                <Broj_prijave>4/21</Broj_prijave>
                <Datum_podnosenja>2021-12-12</Datum_podnosenja>
            </Ranija_prijava>
        </Zahtev_za_priznanje_prava_prvenstva>
    </Zahtev_za_priznanje_patenta>
</Obrazac_P1>